{
  "route_type": "hps_sdk_route",
  "route_id": "hps_sdk_route_allowed_001",
  "capability": "memory.commit",
  "heartbeat_result": "PASS",
  "standing_class": "RESTORED",
  "standing_required": "RESTORED",
  "capability_window_state": "OPEN",
  "supports": {
    "authority_valid": true,
    "policy_current": true,
    "delegation_current": true,
    "evidence_fresh": true,
    "coordinate_valid": true,
    "reconstruction_available": true
  },
  "expiration_triggers": [],
  "expected_decision": "ALLOW"
}
