{
  "route_type": "hps_sdk_route",
  "route_id": "hps_sdk_route_expired_001",
  "capability": "publication.emit",
  "heartbeat_result": "PASS",
  "standing_class": "RESTORED",
  "standing_required": "RESTORED",
  "capability_window_state": "EXPIRED",
  "supports": {
    "authority_valid": true,
    "policy_current": true,
    "delegation_current": true,
    "evidence_fresh": false,
    "coordinate_valid": true,
    "reconstruction_available": true
  },
  "expiration_triggers": ["evidence_stale"],
  "expected_decision": "DENY"
}
